input,index,label,token,cot
"['چنانچہ', 'ایم', 'بی', 'ٹی', 'نے', 'اعظم', 'پورہ', 'ڈیویژن', 'کے', 'تحت', 'تمام', 'خاندانوں', 'کو', 'دیپم', 'اسکیم', 'سے', 'استفادہ', 'حاصل', 'کرنے', 'کے', 'لیے', 'نہ', 'صرف', 'درخواست_گذار', 'خواتین', 'کے', 'فارمس', 'کی', 'خانہ_پری', 'کی', 'بلکہ', 'درخواست', 'داخل', 'کردہ', 'تمام', 'خواتین', 'کو', 'دیپم', 'اسکیم', 'کے', 'تحت', 'تقریبا', '124', 'گیس', 'سیلنڈرس', 'و', 'کنکشن', 'آڈرس', 'کی', 'کاپیاں', 'تقسیم', 'عمل', 'مےں', 'لائی', 'گئی', '۔']",34,8,تمام,"The word ""تمام"" in this context is labeled as a determiner. This is because ""تمام"" is used to specify the noun ""خواتین"" (women), indicating the totality or entirety of the group. Determiners are words that modify nouns to provide context such as quantity, possession, or definiteness. Here, ""تمام"" specifies that all women who applied were included, making it function as a determiner."
"['انتظامیہ', 'سے', 'گذارش', 'کی', 'جاتی', 'ہے', 'کہ', 'ایسے', 'سیریلوں', 'اور', 'ایسی', 'فلموں', 'کی', 'نمائش', 'کی', 'اجازت', 'نہ', 'دے', 'جو', 'عوام', 'کے', 'ذہن', 'پر', 'برا', 'اثر', 'ڈالتی', 'ہوں', '۔']",23,6,برا,"The word ""برا"" in this context is labeled as an adjective. This is because ""برا"" is used to describe the noun ""اثر"" (effect), indicating the negative quality of the effect being discussed. Adjectives are words that modify nouns by providing additional information about their attributes. Here, ""برا"" provides information about the nature of the effect, making it function as an adjective."
"['انہوں', 'نے', 'کہا', 'کہ', 'محض', 'اپنی', 'ناقص', 'کارکردگی', 'کے', 'اظہار', 'سے', 'گریز', 'کرتے', 'ہوئے', 'بیجا', 'اور', 'غلط', 'الزامات', 'عائد', 'کرنا', 'مسٹر', 'چندر', 'شیکھر', 'راؤ', 'کے', 'لیے', 'ہرگز', 'زیب', 'نہیں', 'دیتا', 'بلکہ', 'ان', 'الزامات', 'کے', 'عائد', 'کرنے', 'سے', 'قبل', 'مسٹر', 'کے', 'چندر', 'شیکھر', 'راؤ', 'کو', 'اپنا', 'محاسبہ', 'کر', 'لینا', 'چاہیے', 'تاکہ', 'حقائق', 'سامنے', 'آ', 'سکیں', '۔']",0,11,انہوں,"The word ""انہوں"" in this context is labeled as a pronoun. This is because ""انہوں"" is used to refer to a previously mentioned or understood subject without naming them directly. Pronouns are words that take the place of nouns to avoid repetition and aid in the flow of sentences. Here, ""انہوں"" refers to a specific person mentioned earlier in the text, making it function as a pronoun."
"['انہوں', 'نے', 'کہا', 'کہ', 'محض', 'اپنی', 'ناقص', 'کارکردگی', 'کے', 'اظہار', 'سے', 'گریز', 'کرتے', 'ہوئے', 'بیجا', 'اور', 'غلط', 'الزامات', 'عائد', 'کرنا', 'مسٹر', 'چندر', 'شیکھر', 'راؤ', 'کے', 'لیے', 'ہرگز', 'زیب', 'نہیں', 'دیتا', 'بلکہ', 'ان', 'الزامات', 'کے', 'عائد', 'کرنے', 'سے', 'قبل', 'مسٹر', 'کے', 'چندر', 'شیکھر', 'راؤ', 'کو', 'اپنا', 'محاسبہ', 'کر', 'لینا', 'چاہیے', 'تاکہ', 'حقائق', 'سامنے', 'آ', 'سکیں', '۔']",49,5,تاکہ,"The word ""تاکہ"" in this context is labeled as a subordinating conjunction. This is because ""تاکہ"" is used to connect two clauses, indicating the purpose or reason for the action in the main clause. Subordinating conjunctions introduce a dependent clause and show the relationship between it and the main clause. Here, ""تاکہ"" connects the clause ""مسٹر کے چندر شیکھر راؤ کو اپنا محاسبہ کر لینا چاہیے"" with ""حقائق سامنے آ سکیں,"" explaining the purpose of the self-assessment, making it function as a subordinating conjunction."
"['اگر', 'آپ', 'کے', 'بزرگ', 'آپ', 'کو', 'سالگرہ', 'کی', 'مبارکباد', 'دینا', 'بھول', 'جائیں', 'تو', 'اس', 'پر', 'برا', 'نہ', 'مانیں', 'کیونکہ', 'ان', 'کی', 'یادداشت', 'عمر', 'کی', 'بڑھوتری', 'کی', 'وجہ', 'سے', 'انہیں', 'دھوکا', 'دینے', 'لگی', 'ہے', '۔']",31,17,لگی,"The word ""لگی"" in this context is labeled as an auxiliary verb. This is because ""لگی"" is used to form the verb phrase ""دھوکا دینے لگی ہے,"" indicating an ongoing action or state. Auxiliary verbs are used alongside main verbs to create different tenses, moods, or aspects. Here, ""لگی"" helps convey the continuous aspect of the action ""دھوکا دینے,"" making it function as an auxiliary verb."
"['مشاعرے', 'کی', 'روایت', 'سے', 'شاعری', 'کی', 'روایت', 'کو', 'جدا', 'نہیں', 'کیا', 'جا', 'سکتا', '،', 'یہی', 'سبب', 'ہے', 'کہ', 'مشاعرے', 'مےں', 'ادب', 'ذوق', 'حضرات', 'کا', 'ہجوم', 'امڈ', 'آتا', 'ہے', '۔']",24,0,ہجوم,"The word ""ہجوم"" in this context is labeled as a noun. This is because ""ہجوم"" refers to a group of people or a crowd, which is a person, place, thing, or concept. Nouns serve as the main subject or object within a sentence. Here, ""ہجوم"" describes the group of ""ادب ذوق حضرات"" (literary enthusiasts) attending the event, making it function as a noun."